[
  {
    "schema_version":"brief-event-v1","event_id":"EVT-20260924-HUM7K","captured_at":"2026-09-24T08:53:57+02:00","published_at":"2026-09-21T05:05:00+00:00","title":"Les ventes mondiales de robots humanoïdes n'ont atteint qu'environ 7 000 unités en 2025","factual_summary":"L'International Federation of Robotics a comptabilisé environ 7 000 robots humanoïdes vendus en 2025 pour des usages industriels et de services professionnels, tandis que les pilotes automobiles restent généralement limités à quelques unités ou quelques dizaines.","type":"FACT","theme":"Robotique et investissement","subtheme":"Adoption commerciale des robots humanoïdes","companies":[],"tickers":[],"sector":"Robotics","sources":[{"url":"https://www.reuters.com/technology/humanoid-robot-sales-tally-hit-7000-globally-last-year-2026-09-21/","source_name":"Reuters","source_type":"news"}],"direction":"neutral","horizon":"medium","importance":90,"novelty":92,"confidence":96,"execution_risk":82,"pricing_status":"uncertain","story":{"story_id":null,"relation":"NEW"},"thesis":{"thesis_ids":[],"statement":"Les premières données sectorielles suggèrent que l'adoption commerciale des humanoïdes reste très en retard sur les projections de volumes, malgré l'intensité des investissements et des démonstrations."},"frozen":true
  },
  {
    "schema_version":"brief-event-v1","event_id":"EVT-20260924-AMD1T","captured_at":"2026-09-24T08:53:57+02:00","published_at":"2026-09-21T14:21:00+00:00","title":"AMD dépasse 1 000 milliards de dollars de capitalisation après une hausse de 185% en 2026","factual_summary":"AMD a dépassé pour la première fois 1 000 milliards de dollars de capitalisation; l'action avait progressé de 185% depuis le début de 2026 et se négociait autour de 41 fois les bénéfices attendus à douze mois selon Reuters.","type":"FACT","theme":"IA, semi-conducteurs et Bourse","subtheme":"Valorisation des accélérateurs IA","companies":["Advanced Micro Devices","Nvidia"],"tickers":["AMD","NVDA"],"sector":"Semiconductors","sources":[{"url":"https://www.reuters.com/business/amd-becomes-latest-chipmaker-reach-1-trillion-valuation-ai-demand-2026-09-21/","source_name":"Reuters","source_type":"news"}],"direction":"positive","horizon":"medium","importance":91,"novelty":82,"confidence":97,"execution_risk":48,"pricing_status":"partially_priced","story":{"story_id":null,"relation":"NEW"},"thesis":{"thesis_ids":[],"statement":"La revalorisation d'AMD montre que le marché price désormais une part importante de son potentiel de challenger IA, ce qui augmente l'importance des preuves futures de gains de parts et de croissance des systèmes complets."},"frozen":true
  },
  {
    "schema_version":"brief-event-v1","event_id":"EVT-20260924-OPUS55","captured_at":"2026-09-24T08:53:57+02:00","published_at":"2026-09-22T16:33:00+00:00","title":"Anthropic lance Claude Opus 5.5 avec une forte baisse du coût d'exécution","factual_summary":"Anthropic a lancé Claude Opus 5.5, annoncé comme comparable à son modèle haut de gamme Fable 5.1 tout en coûtant 40% moins cher à exécuter que son prédécesseur; il est disponible via AWS, Google Cloud et Microsoft Azure.","type":"FACT","theme":"IA et logiciels","subtheme":"Économie des modèles de fondation","companies":["Anthropic","Amazon","Alphabet","Microsoft"],"tickers":["AMZN","GOOGL","MSFT"],"sector":"AI software and cloud","sources":[{"url":"https://www.reuters.com/business/anthropic-unveils-claude-opus-55-2026-09-22/","source_name":"Reuters","source_type":"news"}],"direction":"positive","horizon":"medium","importance":88,"novelty":87,"confidence":95,"execution_risk":52,"pricing_status":"uncertain","story":{"story_id":null,"relation":"NEW"},"thesis":{"thesis_ids":[],"statement":"La baisse rapide du coût à performance élevée intensifie la concurrence entre laboratoires de modèles et peut déplacer la valeur vers l'usage, la distribution cloud et les applications plutôt que vers le seul accès au modèle."},"frozen":true
  },
  {
    "schema_version":"brief-event-v1","event_id":"EVT-20260924-BABAV900","captured_at":"2026-09-24T08:53:57+02:00","published_at":"2026-09-22T02:50:00+00:00","title":"Alibaba dévoile le Zhenwu V900 et vise plus de 20 GW de data centers en 2032","factual_summary":"Alibaba a dévoilé son accélérateur IA Zhenwu V900, prévu en production commerciale au premier trimestre 2027, et a fixé un objectif de plus de 20 GW de capacité mondiale de data centers pour Alibaba Cloud d'ici 2032.","type":"FACT","theme":"IA et semi-conducteurs","subtheme":"Accélérateurs IA chinois et interconnexion","companies":["Alibaba Group","Nvidia"],"tickers":["9988","NVDA"],"sector":"Semiconductors","sources":[{"url":"https://www.reuters.com/business/retail-consumer/alibaba-plans-ai-model-with-5-trillion-10-trillion-parameters-unveils-new-chip-2026-09-22/","source_name":"Reuters","source_type":"news"}],"direction":"positive","horizon":"long","importance":94,"novelty":91,"confidence":95,"execution_risk":64,"pricing_status":"partially_priced","story":{"story_id":"STORY-EVT-20260917-HUA960","relation":"CONFIRM"},"thesis":{"thesis_ids":[],"statement":"Les grands groupes chinois construisent des piles IA verticalement intégrées, des modèles aux accélérateurs et aux data centers, afin de réduire leur dépendance aux technologies américaines."},"frozen":true
  }
]
